{
  "arithmetic_function": "modular_inversion",
  "arithmetic_parameters": {
    "bit_length": 8,
    "field": "prime_field",
    "modulus": 251
  },
  "certificate_id": "inv-8bit-toy-transcript",
  "certificate_version": "0.1.0",
  "circuit_hash": "9bfda2b86ef20c58e67d6e36e090ae31bac83bb30f1e9a02569e730a87a86f8c",
  "correctness_transcript": {
    "tests": [
      {
        "passed": true,
        "x": 150,
        "y": 82
      },
      {
        "passed": true,
        "x": 13,
        "y": 58
      },
      {
        "passed": true,
        "x": 48,
        "y": 68
      },
      {
        "passed": true,
        "x": 154,
        "y": 207
      },
      {
        "passed": true,
        "x": 164,
        "y": 75
      },
      {
        "passed": true,
        "x": 226,
        "y": 10
      },
      {
        "passed": true,
        "x": 86,
        "y": 108
      },
      {
        "passed": true,
        "x": 250,
        "y": 250
      },
      {
        "passed": true,
        "x": 156,
        "y": 214
      },
      {
        "passed": true,
        "x": 104,
        "y": 70
      },
      {
        "passed": true,
        "x": 96,
        "y": 34
      },
      {
        "passed": true,
        "x": 110,
        "y": 89
      },
      {
        "passed": true,
        "x": 88,
        "y": 174
      },
      {
        "passed": true,
        "x": 73,
        "y": 196
      },
      {
        "passed": true,
        "x": 125,
        "y": 249
      },
      {
        "passed": true,
        "x": 172,
        "y": 54
      },
      {
        "passed": true,
        "x": 157,
        "y": 8
      },
      {
        "passed": true,
        "x": 185,
        "y": 19
      },
      {
        "passed": true,
        "x": 223,
        "y": 242
      },
      {
        "passed": true,
        "x": 23,
        "y": 131
      },
      {
        "passed": true,
        "x": 188,
        "y": 247
      },
      {
        "passed": true,
        "x": 15,
        "y": 67
      },
      {
        "passed": true,
        "x": 69,
        "y": 211
      },
      {
        "passed": true,
        "x": 186,
        "y": 139
      },
      {
        "passed": true,
        "x": 115,
        "y": 227
      },
      {
        "passed": true,
        "x": 73,
        "y": 196
      },
      {
        "passed": true,
        "x": 53,
        "y": 90
      },
      {
        "passed": true,
        "x": 175,
        "y": 142
      },
      {
        "passed": true,
        "x": 184,
        "y": 236
      },
      {
        "passed": true,
        "x": 84,
        "y": 3
      },
      {
        "passed": true,
        "x": 29,
        "y": 26
      },
      {
        "passed": true,
        "x": 45,
        "y": 106
      }
    ]
  },
  "gate_basis": [
    "NOT",
    "CNOT",
    "TOFFOLI"
  ],
  "io_spec": {
    "domain": "F_p^*",
    "input_register": "x",
    "output_register": "x^{-1} mod p",
    "relation": "x * y % p == 1"
  },
  "proof_artifact": {
    "type": "none"
  },
  "public_circuit": {
    "circuit_file": "circuits/toy_modinv_stub_8bit.json",
    "circuit_hash": "9bfda2b86ef20c58e67d6e36e090ae31bac83bb30f1e9a02569e730a87a86f8c",
    "circuit_id": "toy-modinv-stub-8bit"
  },
  "resource_counts": {
    "ancilla_qubits": 8,
    "cnot_count": 1,
    "depth": 5,
    "logical_qubits": 24,
    "source": "public toy gate-list circuit; not a real modular inversion implementation",
    "toffoli_count": 2
  },
  "test_generation": {
    "exhaustive": false,
    "label": "modinv",
    "method": "shake256",
    "seed_circuit_hash": "481d2e6e5e059b8269d79e155663ccabbfd7ec933b6751d232e0e56b76420f11",
    "test_count": 32
  },
  "transcript_hash": "0362e3f9aa7ed6350faee28e674151dda195889bb9b4a9320f6e068dc3722702"
}
