{
  "arithmetic_function": "toy_cnot_copy",
  "arithmetic_parameters": {
    "bit_length": 2,
    "field": "boolean_bits",
    "modulus": 2
  },
  "certificate_id": "toy_cnot_copy-truth-table-cert",
  "certificate_version": "0.1.0",
  "circuit_hash": "7637440608a196c1aff574afa58574c76da3d19df12a64d0dd5c9c75d41f536b",
  "correctness_transcript": {
    "tests": [
      {
        "input_bits": [
          0,
          0
        ],
        "output_bits": [
          0,
          0
        ],
        "passed": true
      },
      {
        "input_bits": [
          0,
          1
        ],
        "output_bits": [
          0,
          1
        ],
        "passed": true
      },
      {
        "input_bits": [
          1,
          0
        ],
        "output_bits": [
          1,
          1
        ],
        "passed": true
      },
      {
        "input_bits": [
          1,
          1
        ],
        "output_bits": [
          1,
          0
        ],
        "passed": true
      }
    ]
  },
  "gate_basis": [
    "CNOT"
  ],
  "io_spec": {
    "domain": "boolean_bitstrings",
    "input_register": "input_bits",
    "output_register": "output_bits",
    "relation": "toy_cnot_copy"
  },
  "proof_artifact": {
    "type": "none"
  },
  "public_circuit": {
    "circuit_file": "circuits/toy_cnot_copy.json",
    "circuit_hash": "7637440608a196c1aff574afa58574c76da3d19df12a64d0dd5c9c75d41f536b",
    "circuit_id": "toy-cnot-copy"
  },
  "resource_counts": {
    "ancilla_qubits": 0,
    "cnot_count": 1,
    "depth": 1,
    "logical_qubits": 2,
    "serial_depth": 1,
    "source": "public toy gate-list circuit with exhaustive classical truth-table simulation",
    "toffoli_count": 0
  },
  "test_generation": {
    "exhaustive": true,
    "label": "toy_cnot_copy",
    "method": "exhaustive_truth_table",
    "test_count": 4
  },
  "transcript_hash": "18c6c9f70f00402e780e7be32d5502dd6d3b4f88106700b7be12854491df0913"
}
